{
  "schema_version": "1.0",
  "event_id": "evt_internal_01J6RG001",
  "merchant_id": "merchant_demo_001",
  "source": "RAZORPAY",
  "source_event_id": "rzp_event_subscription_pending_001",
  "event_type": "subscription.pending",
  "occurred_at": "2026-08-25T04:31:00Z",
  "received_at": "2026-08-25T04:31:01Z",
  "customer_id": "customer_001",
  "payment_id": "payment_001",
  "order_id": null,
  "subscription_id": "subscription_001",
  "invoice_id": null,
  "payment_link_id": null,
  "amount_minor": 499900,
  "currency": "INR",
  "failure_code": "BAD_REQUEST_ERROR",
  "normalized_failure_category": "INSUFFICIENT_FUNDS",
  "correlation_id": "corr_subscription_001_attempt_01",
  "causation_id": null,
  "source_payload_reference": "webhook_events/rzp_event_subscription_pending_001"
}
